Categories,Created,Description,Experience ID,Participant ID,Sources,Tag,Workshop,0,Categories-Access,Categories-Career,Categories-Compensation,Categories-Interactions,Categories-Learning,Categories-Life,Categories-Recognition,Categories-Respect,Categories-Skills,Sources-Customers,Sources-HR,Sources-Leadership,Sources-Manager,Sources-Peers,Sources-Policy,Sources-Reports
"skills,compensation,recognition",11/12/2020 15:41,"I was told that an expected promotion would not happen as it was felt that I would not understand the market because of my ""ethnicity"".",1281,587,"leadership,manager",,6,,0,0,1,0,0,0,1,0,1,0,0,1,1,0,0,0
"skills,learning,compensation,career,recognition,respect",11/12/2020 15:42,"I have applied repeatedly over several years for senior administrative roles in my organization (a public university).
While I am a full professor & fulfill the requirements of all senior posts that I have applied for (some colleagues have said I am over-qualified, as for example I have industry experience), I have never been shortlisted & interviewed.
Despite requests I have not received any feedback for my repeated rejections.",1282,556,"leadership,hr,peers",,6,,0,1,1,0,1,0,1,1,1,0,1,1,0,1,0,0
"respect,interactions",11/12/2020 15:41,"A higher-up asked if there were any concerns about sexual harassment, I said yes and gave examples about an adjunct professor. I was letter pressured to re-hire this person after making the report.",1283,589,"leadership,manager,peers",,6,,0,0,0,1,0,0,0,1,0,0,0,1,1,1,0,0
"respect,interactions",11/12/2020 15:42,"Upon visiting a new office, I am regularly assumed to be an administrative assistant.",1284,602,peers,,6,,0,0,0,1,0,0,0,1,0,0,0,0,0,1,0,0
"skills,career,recognition",11/12/2020 15:42,"I experience doors closing for career advancement at this company. I show interest and capability to provide value, but am not recognized.",1285,607,"leadership,manager",,6,,0,1,0,0,0,0,1,0,1,0,0,1,1,0,0,0
"respect,interactions,other",11/12/2020 15:42,"When asked if women of color were included in the candidate pool for a key position, my boss responded, ""I'm not a racist. I have black friends.""",1286,554,"leadership,hr,manager",,6,,0,0,0,1,0,0,0,1,0,0,1,1,1,0,0,0
"access,compensation,career,interactions",11/12/2020 15:42,"I worked in corporate America for 12 years. I was quickly promoted up the ladder until I had a male supervisor who felt a woman's place was at home and not in the workforce. I immediately started to encounter as he stated work ""performance issues."" I was targeted by this individual as a person of color, and a female with children. I was excluded from events and work meetings. I eventually left the company.",1287,603,"leadership,hr",,6,,1,1,1,1,0,0,0,0,0,0,1,1,0,0,0,0
respect,11/12/2020 15:43,"I work for a global company.  I am on the west coast while most of my direct co-workers are on the east coast.  One colleague in particular will schedule meetings that are before 8 am my time or during my lunch.  When I bring it up, she states, oh you don't have to attend.  I will fill you in later.  I feel my input is not seen as important.",1288,583,peers,,6,,0,0,0,0,0,0,0,1,0,0,0,0,0,1,0,0
compensation,11/12/2020 15:44,"I held a position after a coworker was promoted, and we were friendly enough to discuss pay. While we both had the same amount of work and education experience, she had been paid a higher starting wage in my new role. She also happened to be 15+ years older than me. I felt I was being unfairly measured based on my age rather than my actual experience in the workplace.",1289,548,hr,,6,,0,0,1,0,0,0,0,0,0,0,1,0,0,0,0,0
AccessParticipation,2/11/2021 12:44,When I would share my input about how to change things with our club but it was immediate dismissed without a reason.,1307,639,"Leadership,Peers",,8,,1,0,0,0,0,0,0,0,0,0,0,1,0,1,0,0
"LearningGrowth,Respect,WorkplaceInteractions",2/11/2021 12:46,"My experience is relatively new. Sometimes I feel that decisions are made for me and directed for me to complete rather than allowing me to make the decision myself. An added bonus is when a determined situation goes sour, I feel that I am the one who has to straighten out the situation.",1308,650,DirectManager,,8,,0,0,0,1,1,0,0,1,0,0,0,0,1,0,0,0
"LearningGrowth,CompensationBenefits,CareerOpportunities",2/11/2021 12:46,I feel that based on my race and gender that I was not offered advanced opportunities that I was more than qualified for. As well as because of my gender and potentially race when offering suggestions on work related items my suggestions and input was over looked,1309,660,"HR,DirectManager",,8,,0,1,1,0,1,0,0,0,0,0,1,0,1,0,0,0
Recognition,2/11/2021 13:13,"I, Tyanna Jackson, witnessed a couple of individuals within BGC1 not be recognized because of their views. However, the went over and beyond the call of duty.",1423,675,Leadership,,8,,0,0,0,0,0,0,1,0,0,0,0,1,0,0,0,0
"AccessParticipation,CareerOpportunities,WorkplaceInteractions",2/11/2021 12:47,Often not invited to participate on task forces or committees.,1311,664,"Leadership,Peers",,8,,1,1,0,1,0,0,0,0,0,0,0,1,0,1,0,0
Respect,2/11/2021 12:47,My staff were show moments of disrespect or even openly argue about an issue largely because I was the new lead staff.,1312,639,Peers,,8,,0,0,0,0,0,0,0,1,0,0,0,0,0,1,0,0
WorkplaceInteractions,2/11/2021 12:47,"There have been multiple occasions when my direct supervisor (different person now), current HR staff, and others in leadership have referenced my age in what I consider an inappropriate context.  When I sought to address this, as was essentially told that at my age... This was the actual problem ironically.",1313,663,"Leadership,HR,DirectManager",,8,,0,0,0,1,0,0,0,0,0,0,1,1,1,0,0,0
"AccessParticipation,LearningGrowth,WorkplaceInteractions",2/11/2021 12:58,I've been looked at as incapable of completing a job or task before in the job that I am currently in. What this does for me is gives me fuel to be greater than any view that comes my way. I slay Naysayers with my success.,1370,668,"Leadership,Reports",,8,,1,0,0,1,1,0,0,0,0,0,0,1,0,0,0,1
"Recognition,Respect",2/11/2021 12:47,"Being a huge team player, and being there whenever and wherever needed. Worked above and beyond and never a thank you and shown appreciation from all of my hard work. Even though everyone else would acknowledge my hard work. Was always left out of acknowledgements during staff meetings and treated as if I was invisible in the bldg by direct manager",1315,652,DirectManager,,8,,0,0,0,0,0,0,1,1,0,0,0,0,1,0,0,0
WorkLifeBalance,2/11/2021 12:48,Being called at Epcot in Orlando on my off day to do work,1316,662,Leadership,,8,,0,0,0,0,0,1,0,0,0,0,0,1,0,0,0,0
AccessParticipation,2/11/2021 12:49,I have been talked over or ignored during meetings,1317,685,DirectManager,,8,,1,0,0,0,0,0,0,0,0,0,0,0,1,0,0,0
AccessParticipation,2/11/2021 12:49,because of pandemic protocols.,1318,678,"Leadership,DirectManager,Peers",,8,,1,0,0,0,0,0,0,0,0,0,0,1,1,1,0,0
WorkplaceInteractions,2/11/2021 12:51,"When I was new to the team, i definitely didn't feel included at first. Everyone had super close relationships and it was hard to feel comfortable eating lunch with everyone/interacting in meetings etc. at first because of all the inside jokes and what not. I don't think it was anyone's fault just something to think about when new hires come in. We often call our org a family, but it was like I had to be accepted into that family first before being invited/feel comfortable.",1330,657,Peers,,8,,0,0,0,1,0,0,0,0,0,0,0,0,0,1,0,0
"AccessParticipation,SkillsUseAssignments,Respect",2/11/2021 12:49,Being left out of crucial conversations and/or meetings that affect my role directly.,1320,659,"Leadership,Peers",,8,,1,0,0,0,0,0,0,1,1,0,0,1,0,1,0,0
WorkplaceInteractions,2/11/2021 12:53,My experience have been very good with the organization. I've only had one incident with a administrator who made me feel unwanted in the organization 4 years ago.,1321,691,Reports,,8,,0,0,0,1,0,0,0,0,0,0,0,0,0,0,0,1
CompensationBenefits,2/11/2021 12:50,"Being younger on the team, I feel that I am not getting the compensation/title for my role that someone else with my work ethic and experience would.",1322,646,HR,,8,,0,0,1,0,0,0,0,0,0,0,1,0,0,0,0,0
"SkillsUseAssignments,Respect,WorkplaceInteractions",2/11/2021 12:58,I have been left off multiple calendar invites and meetings that are directly related to my chart of work.,1364,674,"Leadership,Peers",,8,,0,0,0,1,0,0,0,1,1,0,0,1,0,1,0,0
SkillsUseAssignments,2/11/2021 12:50,I wasn't included in decisions around metrics reporting after I'd designed the new method for data collection.,1324,673,Leadership,,8,,0,0,0,0,0,0,0,0,1,0,0,1,0,0,0,0
"Respect,WorkplaceInteractions",2/11/2021 12:50,I have often been described as overly emotional at work while my male coworkers are seen as passionate or assertive.,1325,651,"Leadership,DirectManager,Peers",,8,,0,0,0,1,0,0,0,1,0,0,0,1,1,1,0,0
CareerOpportunities,2/11/2021 13:11,I was excluded by leadership because of my age and no regard for my education.,1326,649,Leadership,,8,,0,1,0,0,0,0,0,0,0,0,0,1,0,0,0,0
LearningGrowth,2/11/2021 12:50,Good,1327,691,Leadership,Positive experience,8,,0,0,0,0,1,0,0,0,0,0,0,1,0,0,0,0
"Respect,WorkplaceInteractions",2/11/2021 12:50,During meetings I would sometimes be looked over or I felt as if my contributions weren't valued.,1328,653,Leadership,,8,,0,0,0,1,0,0,0,1,0,0,0,1,0,0,0,0
"Respect,WorkplaceInteractions",2/11/2021 12:50,Have been told I am not really Hispanic.  Many people in the org don't seem to realize that Latino comes in many variations.  Was also told not to refer to myself as Hispanic...That the correct term is Latin X.  Upon research it turns out that most of us still prefer Hispanic. I don't think others should be able to tell you how to identify.,1329,663,"Leadership,DirectManager,Peers",,8,,0,0,0,1,0,0,0,1,0,0,0,1,1,1,0,0
"Respect,WorkplaceInteractions",2/11/2021 12:51,"Within my first month of employment I was part of cohort meeting with my peers from the organization.  The topic of the meeting was unconscious bias.  During a share moment a peer was describing a moment they experienced, stopped in the middle to look at me sitting next to them and said ""you wouldn't understand"".  This assumption made me feel really embarrassed and angry as this peer had no idea who I am or what I have experienced.",1331,647,Peers,,8,,0,0,0,1,0,0,0,1,0,0,0,0,0,1,0,0
SkillsUseAssignments,2/11/2021 12:51,"One experience of exclusion for me, was when I was viewed as too young to have valuable input in a  decision where I was the content expert .",1332,667,Leadership,,8,,0,0,0,0,0,0,0,0,1,0,0,1,0,0,0,0
"LearningGrowth,Respect,WorkplaceInteractions",2/11/2021 13:12,I actually heard someone on the Sr. Leadership Team speak negatively of me (I heard with my own ears the statement they made about me).,1334,674,Leadership,,8,,0,0,0,1,1,0,0,1,0,0,0,1,0,0,0,0
LearningGrowth,2/11/2021 12:51,I was once an I interim Teen Director and when. We had a all club stuff training I was told I couldn't go into the Full time Directors training that I had to go to the part time room. I,1335,680,HR,,8,,0,0,0,0,1,0,0,0,0,0,1,0,0,0,0,0
"SkillsUseAssignments,Respect",2/11/2021 12:51,I have felt excluded when engaging with members younger members of the organization who assume that they have skills or life experiences that I cannot relate to because of my age.,1336,672,"Peers,Reports",,8,,0,0,0,0,0,0,0,1,1,0,0,0,0,1,0,1
AccessParticipation,2/11/2021 13:48,"Intentionally excluding me/my club from participation in several programs or  opportunities due to persons' perception of me. Generally, if you're not in a certain clique you are often boxed in and ostracized.",1337,654,"Leadership,HR,Peers",,8,,1,0,0,0,0,0,0,0,0,0,1,1,0,1,0,0
CareerOpportunities,2/11/2021 12:51,"When I was working in professional sports I experienced exclusion being a woman, working in a male dominated field.",1338,669,Peers,,8,,0,1,0,0,0,0,0,0,0,0,0,0,0,1,0,0
"AccessParticipation,SkillsUseAssignments,LearningGrowth,CareerOpportunities",2/11/2021 12:51,Overlooked - and general access - to promotion. Opportunities for leadership/professional development. I don't believe this is done intentionally or maliciously. I believe it's mostly an oversight - which suggests a larger issue.,1339,682,Leadership,,8,,1,1,0,0,1,0,0,0,1,0,0,1,0,0,0,0
Recognition,2/11/2021 12:51,Our organization often highlights Club facing positions more than Support Center positions.,1340,670,Leadership,,8,,0,0,0,0,0,0,1,0,0,0,0,1,0,0,0,0
AccessParticipation,2/11/2021 12:51,I have been omitted from discussions and decisions which would have benefited from my knowledge.,1341,663,"Policy,Leadership,DirectManager",,8,,1,0,0,0,0,0,0,0,0,0,0,1,1,0,1,0
"Respect,WorkplaceInteractions",2/11/2021 12:52,"I have been described as a bitch (semi-jokingly) because I do not engage in as much small talk or companionship in our workplace while male coworkers are seen as hard-working, assertive or direct.",1343,651,"Leadership,Peers",,8,,0,0,0,1,0,0,0,1,0,0,0,1,0,1,0,0
AccessParticipation,2/11/2021 12:52,I was looked over and not included in an important meeting where I could have been of value and talked about my personal experience with a particular club and its members,1344,656,Peers,,8,,1,0,0,0,0,0,0,0,0,0,0,0,0,1,0,0
WorkLifeBalance,2/11/2021 12:52,"I really appreciate the flexibility working from home has given us over the past year, but it has gotten to a point where it is too flexible, for me. Late afternoon meetings have been kind of interfering with my boundaries with work/home time, but I feel that since I am younger and do not yet have a family that others expect me to be okay with these late meetings and not have an issue with it.",1345,646,"Leadership,Customers",,8,,0,0,0,0,0,1,0,0,0,1,0,1,0,0,0,0
"Respect,WorkplaceInteractions",2/11/2021 12:52,Attempt to give the appearance that they are listening to you when you speak when in reality they do not care. Isolate you from the team and share with you things and then later deny it was said or claim that it was a misunderstanding.,1346,687,"Leadership,DirectManager",,8,,0,0,0,1,0,0,0,1,0,0,0,1,1,0,0,0
"AccessParticipation,CareerOpportunities,Respect",2/11/2021 12:58,"I felt that since I was young, I was overlooked for opportunities.",1348,658,"Leadership,Peers",,8,,1,1,0,0,0,0,0,1,0,0,0,1,0,1,0,0
"Recognition,Respect,WorkplaceInteractions",2/11/2021 12:59,"I have heard peers say that they believe homosexuality is a sin or that they don't agree with the ""lifestyle choices"" of our gay teens.",1372,651,Peers,,8,,0,0,0,1,0,0,1,1,0,0,0,0,0,1,0,0
AccessParticipation,2/11/2021 12:52,Preparing the budget for staff.  Told we will have to complete but is done for us without a conversation.,1349,689,"Leadership,DirectManager",,8,,1,0,0,0,0,0,0,0,0,0,0,1,1,0,0,0
WorkLifeBalance,2/11/2021 12:52,"Expectation to participate in activities outside of normal work hours... with a toddler at home it is very hard for me to go ""above and beyond"" and volunteer or attend evening/weekend events, especially when I already feel overwhelmed by my current work load. (This was pre-pandemic.)",1350,642,"DirectManager,Peers",,8,,0,0,0,0,0,1,0,0,0,0,0,0,1,1,0,0
"AccessParticipation,Respect",2/11/2021 12:52,This experience looks a lot like being in a job where my views or concerns are not voiced or spoken on. This had yielded me to stay quiet in most conversations.,1352,668,Leadership,,8,,1,0,0,0,0,0,0,1,0,0,0,1,0,0,0,0
"AccessParticipation,SkillsUseAssignments,LearningGrowth,CareerOpportunities,WorkLifeBalance,Respect,WorkplaceInteractions",2/11/2021 12:52,My experience throughout the years has been average,1353,679,Leadership,Positive experience,8,,1,1,0,1,1,1,0,1,1,0,0,1,0,0,0,0
Respect,2/11/2021 12:53,While working through brainstorming sessions regarding organizational change my ideas and opinions were dismissed multiple times.  Others felt like they are the content experts and know better than others.  We now are in a situation because all opinions were not being considered.  It has us trying fix it while we are in it.,1354,676,Peers,,8,,0,0,0,0,0,0,0,1,0,0,0,0,0,1,0,0
"Recognition,Respect,WorkplaceInteractions",2/11/2021 12:53,"In the midst of a particular race, conversations about African American celebrities, culture, etc is always the topic because I'm African American. It makes it uncomfortable to listen to.",1356,665,"HR,Peers",,8,,0,0,0,1,0,0,1,1,0,0,1,0,0,1,0,0
"Respect,WorkplaceInteractions",2/11/2021 12:53,I was steam rolled in a meeting. I believe others were aware and recognized what was happening but I think there were politics involved. I was very young and new at the time.,1357,682,"DirectManager,Peers",,8,,0,0,0,1,0,0,0,1,0,0,0,0,1,1,0,0
WorkLifeBalance,2/11/2021 12:54,I find that work life balance is my place of exclusion. I spend a lot of time at work and thinking about work. It is difficult for me to forget about work. I am always concern about the best way to reach more children and better serve my staff. My personal life gets buried in my work life.  I watch others that do work similar to mine. Do it easily.,1358,683,"Policy,Leadership",,8,,0,0,0,0,0,1,0,0,0,0,0,1,0,0,1,0
WorkLifeBalance,2/11/2021 12:54,Requests for meetings outside of traditional work hours,1359,670,Peers,,8,,0,0,0,0,0,1,0,0,0,0,0,0,0,1,0,0
WorkplaceInteractions,2/11/2021 12:54,"My supervisor rarely acknowledges my dedication and hard work. Also, my team isn't the most supportive.",1360,649,DirectManager,,8,,0,0,0,1,0,0,0,0,0,0,0,0,1,0,0,0
Respect,2/11/2021 12:55,I did not feel respected because of my age. Alot of the people I work with are older and I feel like they don't respect me because I'm younger.,1361,655,Peers,,8,,0,0,0,0,0,0,0,1,0,0,0,0,0,1,0,0
"SkillsUseAssignments,Recognition,WorkplaceInteractions",2/11/2021 13:12,There have been times when I have gone above and beyond my job and have not been recognized. I have done other co-workers jobs and still nothing. Then when the club is recongnized for it's hard work the other staff get the praise for it.,1419,655,"DirectManager,Peers",,8,,0,0,0,1,0,0,1,0,1,0,0,0,1,1,0,0
"AccessParticipation,LearningGrowth,Respect,WorkplaceInteractions",2/11/2021 12:56,I believe that my age plays a role in the what jobs are available to me and what role I can play in making decisions.,1363,651,"Leadership,DirectManager",,8,,1,0,0,1,1,0,0,1,0,0,0,1,1,0,0,0
"AccessParticipation,LearningGrowth,CareerOpportunities,Respect",2/11/2021 13:11,During all org DEI forum all negative comments were directed at Senior Team Leadership and a lack of Diversity on the team as the team at the time was majority Caucasian.  Followed up with a recent org wide survey that continued with those same complaints/concerns.  This makes me feel as I do not belong or have a place to move up career wise within the org.,1414,647,Peers,,8,,1,1,0,0,1,0,0,1,0,0,0,0,0,1,0,0
Recognition,2/11/2021 12:57,They tent to recognize the newer staff instead of the ones that have been here longer. Even when the new staff are doing the samething as the staff that have been here longer.,1366,655,Leadership,,8,,0,0,0,0,0,0,1,0,0,0,0,1,0,0,0,0
WorkplaceInteractions,2/11/2021 12:58,Comments made about my non-southern accents,1367,670,Customers,,8,,0,0,0,1,0,0,0,0,0,1,0,0,0,0,0,0
SkillsUseAssignments,2/11/2021 12:58,I feel my skills and knowledge are somewhat underestimated,1368,685,"DirectManager,Peers",,8,,0,0,0,0,0,0,0,0,1,0,0,0,1,1,0,0
"CompensationBenefits,CareerOpportunities,Respect",2/11/2021 12:58,"I feel that I am treated as if I am dumb because I am black, and do not have the cognitive ability to do the job.",1369,658,"Leadership,Peers",,8,,0,1,1,0,0,0,0,1,0,0,0,1,0,1,0,0
"AccessParticipation,WorkLifeBalance",2/11/2021 12:58,Wasn't consulted about the Chamblee move.,1371,673,Leadership,,8,,1,0,0,0,0,1,0,0,0,0,0,1,0,0,0,0
Respect,2/11/2021 13:11,"Senior Leadership referenced a quote from a hip hop song and assumed I knew what they were referring to after my interview. This made me feel uncomfortable because they thought I knew the music, and as a new hire, I was too nervous about reporting them to HR.",1373,649,Leadership,,8,,0,0,0,0,0,0,0,1,0,0,0,1,0,0,0,0
WorkLifeBalance,2/11/2021 12:59,It's very hard to have a work life balance with this job. The hours are sometimes crazy. The parents sometimes do not pick the members up on time and there are no concequense for it.,1374,655,"Leadership,DirectManager,Customers",,8,,0,0,0,0,0,1,0,0,0,1,0,1,1,0,0,0
"SkillsUseAssignments,CareerOpportunities,Respect,WorkplaceInteractions",2/11/2021 12:59,"I am a black male, people are afraid of me and do not want me to be in a position of authority in this organization.",1375,658,"Leadership,Peers",,8,,0,1,0,1,0,0,0,1,1,0,0,1,0,1,0,0
CareerOpportunities,2/11/2021 12:59,I applied for another position in my department and the outside candidate that was hired instead was not as qualified as me. I should note that the candidate was let go after a few months and I was promoted to the position. But until that time I was frustrated and was felt excluded by the leadership of my department.,1376,642,"Leadership,DirectManager",,8,,0,1,0,0,0,0,0,0,0,0,0,1,1,0,0,0
"AccessParticipation,LearningGrowth",2/11/2021 12:59,"I feel left out of meetings or conversations I would like to join, even if it's simply to listen and learn",1377,685,"DirectManager,Peers",,8,,1,0,0,0,1,0,0,0,0,0,0,0,1,1,0,0
WorkLifeBalance,2/11/2021 12:59,"Some of us without young children have more often been assigned late hours, weekend or extra tasks.  It has been explicitly stated that it's because we don't have young families. This seems to imply that our time is not equal.",1378,663,"Leadership,DirectManager",,8,,0,0,0,0,0,1,0,0,0,0,0,1,1,0,0,0
WorkplaceInteractions,2/11/2021 12:59,I have seen other female co-workers reprimanded for their clothes worn and others wearing similar items not reprimanded at all.,1379,670,"Leadership,HR",,8,,0,0,0,1,0,0,0,0,0,0,1,1,0,0,0,0
LearningGrowth,2/11/2021 13:00,A lot of time there's no training in my position directly from my supervisor and it leaves me feeling excluded when situations arise and I'm unable to accomplish what's at hand.,1380,680,DirectManager,,8,,0,0,0,0,1,0,0,0,0,0,0,0,1,0,0,0
CompensationBenefits,2/11/2021 13:00,The car I drive makes people of a different race upset. They give looks and make wild assumptions of my means of finance. When these situations happen I ignore them and continue to strive to be the best I can be.,1381,668,Peers,,8,,0,0,1,0,0,0,0,0,0,0,0,0,0,1,0,0
"AccessParticipation,SkillsUseAssignments,Respect",2/11/2021 13:00,"As an Executive Director excluded from making decisions about registration, fees, and ADA yet is solely responsible for the process.",1382,689,"Leadership,DirectManager",,8,,1,0,0,0,0,0,0,1,1,0,0,1,1,0,0,0
"CompensationBenefits,WorkLifeBalance",2/11/2021 13:05,I have that the organization tries to create a formula for everyone working. They do not dive in and take into account what each person is responsible for and pay them accordingly.,1383,658,"Policy,Leadership,HR",,8,,0,0,1,0,0,1,0,0,0,0,1,1,0,0,1,0
"Respect,WorkplaceInteractions",2/11/2021 13:01,"Told to ""stand down"" during an emotional group conversation when I believed the group was beginning to personally attack a colleague who was not the decision maker of the topic that was heatedly being discussed.",1384,647,DirectManager,,8,,0,0,0,1,0,0,0,1,0,0,0,0,1,0,0,0
"CompensationBenefits,WorkLifeBalance,Respect",2/11/2021 13:01,"I was working 12 hours a day, seven days a week for several months. It took 10 months to back fill my old position.",1385,673,"Leadership,HR,DirectManager",,8,,0,0,1,0,0,1,0,1,0,0,1,1,1,0,0,0
"CompensationBenefits,CareerOpportunities,WorkLifeBalance",2/11/2021 13:01,Feeling voiceless in speaking about things of concern due to repercussions of losing one's job or being demoted.,1386,687,"Leadership,HR,DirectManager",,8,,0,1,1,0,0,1,0,0,0,0,1,1,1,0,0,0
CompensationBenefits,2/11/2021 13:11,"Significant salary differences between minority and non-minority employees with similar career experience. 

i have witnessed this, but it did not happen to me.",1387,670,Peers,,8,,0,0,1,0,0,0,0,0,0,0,0,0,0,1,0,0
AccessParticipation,2/11/2021 13:02,Working at *company* I would not be included in meetings due to my position but I truly believe it was because I am a female.,1388,675,Leadership,Past experience,8,,1,0,0,0,0,0,0,0,0,0,0,1,0,0,0,0
WorkplaceInteractions,2/11/2021 13:02,I feel that sometimes I'm not asked to be part of the organization restructuring process.,1389,692,Leadership,,8,,0,0,0,1,0,0,0,0,0,0,0,1,0,0,0,0
"SkillsUseAssignments,CompensationBenefits",2/11/2021 13:03,There have been moments where knowledge is suppressed and or not used due to favoritism.,1390,677,DirectManager,,8,,0,0,1,0,0,0,0,0,1,0,0,0,1,0,0,0
SkillsUseAssignments,2/11/2021 13:21,My skills are used and tapped daily. However only to benefit the person presenting typically those in the major decision making positions (Leadership) but I am never openly credited for my work or given an open platform to lead.,1391,654,"Policy,Leadership,HR,Peers,Reports",,8,,0,0,0,0,0,0,0,0,1,0,1,1,0,1,1,1
LearningGrowth,2/11/2021 13:11,"Minority employees who were not granted advancement opportunities even though performance was high.

I have witnessed this, but it did not happen to me.",1392,670,Peers,,8,,0,0,0,0,1,0,0,0,0,0,0,0,0,1,0,0
SkillsUseAssignments,2/11/2021 13:03,I have a certain skill set and my supervisor did not acknowledge it in a way that could benefit the entire event.,1393,667,DirectManager,,8,,0,0,0,0,0,0,0,0,1,0,0,0,1,0,0,0
