Categories,Created,Description,Experience ID,Participant ID,Sources,Tag,Workshop,0,Categories-Access,Categories-Career,Categories-Compensation,Categories-Interactions,Categories-Learning,Categories-Life,Categories-Recognition,Categories-Respect,Categories-Skills,Sources-Customers,Sources-HR,Sources-Leadership,Sources-Manager,Sources-Peers,Sources-Policy,Sources-Reports
other,6/10/2020 15:16,"Some may not find this offensive, however I don't like it when males have me walk into an elevator or through the door first because I'm female. I want to be treated as an equal.",450,81,peers,,7,,0,0,0,0,0,0,0,0,0,0,0,0,0,1,0,0
"compensation,career",6/10/2020 15:16,I have similar performance goals and work responsibilities with my male colleague however we have different titles and pay grades.,451,165,manager,,7,,0,1,1,0,0,0,0,0,0,0,0,0,1,0,0,0
"recognition,respect",6/10/2020 15:17,I am not given the support of confidence by management.,452,145,"manager,leadership",,7,,0,0,0,0,0,0,1,1,0,0,0,1,1,0,0,0
"access,skills",6/10/2020 14:46,I am not given opportunities to voice my opinions.,92,103,"manager,leadership,peers",,7,,1,0,0,0,0,0,0,0,1,0,0,1,1,1,0,0
"skills,recognition,respect",6/10/2020 15:18,Male managers are able to push through promotions a lot easier than female managers.,455,51,leadership,,7,,0,0,0,0,0,0,1,1,1,0,0,1,0,0,0,0
"respect,interactions",6/10/2020 15:19,I have had inappropriate comments made to me based on my gender as a women.,456,154,manager,,7,,0,0,0,1,0,0,0,1,0,0,0,0,1,0,0,0
career,6/10/2020 15:19,White males disproportionally make up the management of *company*. The minorities and females hit a glass ceiling when trying to move up the management ladder. The perception is that minorities and females must work 3X times harder and put in more time at the organization before being permitted to move up the ladder.,457,181,peers,,7,,0,1,0,0,0,0,0,0,0,0,0,0,0,1,0,0
"skills,career",6/10/2020 15:19,I am consistently passed over for special projects that produce a higher IC or lead to a higher position.,458,145,"manager,leadership",,7,,0,1,0,0,0,0,0,0,1,0,0,1,1,0,0,0
"skills,career,life",6/10/2020 15:20,"While being given opportunity for special projects, because base work is not regulated as a result, I end up overwhelmed and feel like I have to pass over interesting additional opportunities.",459,131,"manager,leadership",,7,,0,1,0,0,0,1,0,0,1,0,0,1,1,0,0,0
"compensation,career",6/10/2020 15:20,"My particular personality type (introverted and analytical) receives less recognition than outspoken and assertive individuals. The ""goals"" for our group seem to try to mold individuals into a particular type of person rather than value the diverse skill sets that exist on my team. Those who are promoted are prototypes of the white males who lead my group.",460,59,"manager,leadership,hr",,7,,0,1,1,0,0,0,0,0,0,0,1,1,1,0,0,0
access,6/10/2020 15:20,Minority religious events do not always get the same recognition.,461,51,peers,,7,,1,0,0,0,0,0,0,0,0,0,0,0,0,1,0,0
"access,skills,learning,compensation,career,life,recognition,respect,interactions",6/10/2020 15:21,"It's incredibly difficult to share details when I have lost trust... I believe that the numbers will tell you. How many employees have never been promoted? At the same pay grade level. Gender? Race? Why? 

Managers provide one lens to their superiors and HR. How can leaders get the truth? How can employees feel safe?",462,64,"manager,leadership,policy,hr,peers",,7,,1,1,1,1,1,1,1,1,1,0,1,1,1,1,1,0
career,6/10/2020 15:21,Because I am an older employee I am often overlooked for special opportunities,463,192,manager,,7,,0,1,0,0,0,0,0,0,0,0,0,0,1,0,0,0
"life,recognition,respect",6/10/2020 15:21,The supporting staff do not get the same work life balance as everyone in the company. They get less work from home days. On *company* Volunteer days the lower level staff needs to use personal time or make up the time if the event is less then 8 hours.  Everyone else gets to go home and do not need to make up the time which discourages the supporting staff to volunteer.,464,160,leadership,,7,,0,0,0,0,0,1,1,1,0,0,0,1,0,0,0,0
"career,respect,interactions",6/10/2020 15:21,"I agree, if you do not go to happy hour or do outside social activities with management, then you will NOT get a promotion.",465,145,manager,,7,,0,1,0,1,0,0,0,1,0,0,0,0,1,0,0,0
life,6/10/2020 15:23,I am married with no children - I feel that I am treated differently and get little empathy for my household issues and obligations,467,192,"manager,leadership",,7,,0,0,0,0,0,1,0,0,0,0,0,1,1,0,0,0
"compensation,career,life",6/10/2020 15:23,"I feel like because I am a lower level employee, I have to complete and volunteer for work more (including extracurricular activity/projects) to get promoted, even though it seems like I'm doing similar work as some higher level employees who completed less work and are not volunteering for extra work or projects.",468,81,"manager,leadership",,7,,0,1,1,0,0,1,0,0,0,0,0,1,1,0,0,0
"career,recognition,respect",6/10/2020 15:24,"When you look at the make up of the executives at *company*, it appears like they are more alike (white males) to each other than diversified. 
I have put a great deal of effort into my career here at *company* and have been passed over for promotions multiple times, yet watch as others, that appear to have a more consistent look to those at the top, get promotions in half the time or less.
I still feel like *company* is a great place to work, but have given up believing I will get a leadership promotion ever. 
I have resigned myself to just be a 40hr a week worker and will not be going above and beyond as I did for the first six years.",469,47,leadership,,7,,0,1,0,0,0,0,1,1,0,0,0,1,0,0,0,0
"skills,learning,compensation,recognition,respect",6/10/2020 15:24,I asked several times why I was not being promoted to the next level. However my manager could not tell me what I needed to do to get promoted. He would say just keep doing what you're doing and your work is fine. I felt very discouraged and unmotivated. I was finally promoted along with several others who were not necessarily deserving of a promotion. I felt like they just promoted everyone because we were all complaining.,470,154,"manager,leadership,hr",,7,,0,0,1,0,1,0,1,1,1,0,1,1,1,0,0,0
compensation,6/10/2020 15:25,Grade levels need to be abolished at *company*.  The broker-dealer community in which we service does not have this type of structure- only the federal government.  If I am going to be stuck at a grade level than I should have a pension just like other federal employees.  Grade levels buttonhole employees.,471,192,"policy,hr",,7,,0,0,1,0,0,0,0,0,0,0,1,0,0,0,1,0
skills,6/10/2020 14:50,Asked to complete tasks that are so simple that I do not feel challenged.,216,179,manager,,7,,0,0,0,0,0,0,0,0,1,0,0,0,1,0,0,0
skills,6/10/2020 15:26,"As a woman, I have been pressured into party planning activities for years. This has nothing to do with my job, yet it's continually mentioned in my performance evaluation. I am no more qualified to plan parties than any of the men in the office. I am excellent at my job and feel degraded when managers value housekeeping work over the regulatory value I bring to *company*.",473,67,"manager,leadership",,7,,0,0,0,0,0,0,0,0,1,0,0,1,1,0,0,0
career,6/10/2020 15:27,Grade levels prevent employees to expand their experiences.  Example:I am a 47 with 30 years of Wall Street experience but my department would never permit me to speak at an industry conference even though I have more experience than my managers and leadership people.,474,192,"manager,leadership",,7,,0,1,0,0,0,0,0,0,0,0,0,1,1,0,0,0
"learning,compensation,career,respect",6/10/2020 15:28,"I have felt many times that I was not promoted faster or given opportunities earlier, because I look young for my age. I have always consistently asked for opportunities and volunteer to help others when I have availability.",475,81,"manager,leadership",,7,,0,1,1,0,1,0,0,1,0,0,0,1,1,0,0,0
"access,interactions",6/10/2020 15:29,"My department has working groups that discuss and implement things such as communications, diversity a inclusion and culture. However, each group is lead by or has heavy participation from the department management team.  The only ideas that are implemented or those that appeal to management. I no longer have a desire to contribute my time or energy because it is not valued. The biggest negative is that lack of participation in these groups labels you as disengaged.",477,103,"manager,leadership",,7,,1,0,0,1,0,0,0,0,0,0,0,1,1,0,0,0
interactions,6/10/2020 15:31,"During this pandemic, I was amazed how tone deaf my counterparts in Rockville are.  I live in NYC and not one person whether it was a peer or management including senior management asked me or my colleagues how we were surviving watching the number of deaths on a daily basis.  I gave up participating in ""coffee breaks"" and other Zoom meetings.",478,192,manager,,7,,0,0,0,1,0,0,0,0,0,0,0,0,1,0,0,0
respect,6/10/2020 15:34,"In the past, I have not always been included in relevant conversations or meetings and at times my opinions are ignored or not valued, and I have been talked over, as if I am not in the room, despite my knowledge, experience, and expertise.

Likewise, in meetings with firms sometimes people are conditioned to defer to people that look like them.  As a result, I end up spoon feeding jr. examiners & managers answers so that they can answer questions, while I sit on the sidelines.",479,141,leadership,,7,,0,0,0,0,0,0,0,1,0,0,0,1,0,0,0,0
interactions,6/10/2020 15:34,"My department is located in Rockville although there is a handful of us that work in NYC. It is amazing how during calls that complained about not being able to walk down the hall to visit each other in their offices.  Once again, not remembering or recognizing that some of us don't have that luxury. This is disappointing considering some of the comments were made by senior management.  So what are we to think? That Todd will close the NYC office?? interesting....",480,192,leadership,,7,,0,0,0,1,0,0,0,0,0,0,0,1,0,0,0,0
"career,respect",6/10/2020 15:34,"The senior managers in my group who are young-ish, white, male, and from what I understand, upper middle class, have no incentive to include others unlike them as they are insulated and comfortable at the top. These men are regarded highly by the organization and are knowledgeable about the relevant subject matter of the work they do, which reinforcing the unlikeliness of a leadership shuffle.  When my senior managers do try to address issues (such as the recent unrest and police violence), it feels forced, superficial, and frankly uncomfortable. Even though they do try, their ignorance and lack of self awareness is burdensome and frustrating. The individual *company* recently hired to supervise at the very top of the umbrella in my department is literally the same type of person (young-ish, white, male). When will others who don't look like them or who have had different life experiences than them have an opportunity to advance and receive recognition? It feels like never. *company* is a product of its own making in this regard.",481,59,"manager,leadership,hr",,7,,0,1,0,0,0,0,0,1,0,0,1,1,1,0,0,0
"access,career",6/10/2020 15:35,"In almost every meeting of 10+ people I have attended in the last few years, I have counted the number of men and women attending. Men generally represent 70-80% of any gathering while women comprise only about 20-30%. This is at all levels and departments. There is no inherent reason for this overweighting, which makes me believe that there is a systemic male bias in hiring and promotion. When you look at the VP level and higher, it is almost all men, almost all of whom are white. Women need to be better represented at all levels.",482,175,"leadership,policy,hr",,7,,1,1,0,0,0,0,0,0,0,0,1,1,0,0,1,0
"respect,interactions",6/10/2020 15:35,"One time I overheard a male manager tell a female employee to ""smile"" as she walked down the hall. This is a common phenomenon women experience from strangers while walking down the street. Women should not have to deal with this in the office. This same male manager challenges women's views in meetings but agrees with men who make the exact same points. He has been in charge of a *company* office location for years and many of his former female subordinates have transferred to other internal groups or office locations. The behavior is subtle enough that escalating to HR would not be appropriate, but it's just enough for women to feel marginalized.",483,67,leadership,,7,,0,0,0,1,0,0,0,1,0,0,0,1,0,0,0,0
career,6/10/2020 15:37,*company* is like the US military - there is little room at the top so getting recognized or promoted is way too difficult. It's a great place to park time until one finds a new job in the industry or plans to retire.  Certain departments people got better titles and promotions that don't do the job that I currently perform.,484,192,leadership,,7,,0,1,0,0,0,0,0,0,0,0,0,1,0,0,0,0
access,6/10/2020 15:37,I experienced being advised by a manager to not to speak to an employee directly but communicate through another employee so that I do not upset them.,485,195,"manager,peers",,7,,1,0,0,0,0,0,0,0,0,0,0,0,1,1,0,0
"career,respect",6/10/2020 15:38,"The senior managers in my group who are young-ish, white, male, and from what I understand, upper middle class, have no incentive to include others unlike them as they are insulated and comfortable at the top. These men are regarded highly by the organization and are knowledgeable about the relevant subject matter of the work they do, which reinforces the unlikeliness of a leadership shuffle. When my senior managers do try to address issues (such as the recent unrest and police violence), it feels forced, superficial, and frankly uncomfortable. Even though they do try, their ignorance and lack of self awareness is burdensome and frustrating. The individual *company* recently hired to supervise at the very top of the umbrella in my department is literally the same type of person (young-ish, white, male). When will others who don't look like them or who have had different life experiences than them have an opportunity to advance and receive recognition? It feels like never. *company* is a product of its own making in this regard.
Okay to anonymously refer to this experience during the workshop",486,59,"manager,leadership,hr",,7,,0,1,0,0,0,0,0,1,0,0,1,1,1,0,0,0
respect,6/10/2020 15:42,"In order to get ahead, one has to act and dress like their manager.  I was put an uncomfortable position when my department head noticed my luxury handbag on a trip.  I had to remind her that it was my husband's ""right"" to give me this gift.  I also hid where I grew up since my manager would be prejudiced against me (well known suburb on NYC) and so I have misled my colleagues to avoid that ""eye roll"".",488,192,"manager,peers",,7,,0,0,0,0,0,0,0,1,0,0,0,0,1,1,0,0
compensation,6/10/2020 15:45,"My boss does not allow my team to work from home 3 days a week, but all other teams in the department do",491,103,manager,,7,,0,0,1,0,0,0,0,0,0,0,0,0,1,0,0,0
skills,6/10/2020 15:45,"I was informed by a manager that I was not qualified because I did not have a legal degree compared to someone else and was removed from a role that I held for 10 years+. After being placed in the role, the replacement sat for the bar to earn the designation and still shows difficulty in mastering associated tasks. I hold three degrees.",492,195,manager,,7,,0,0,0,0,0,0,0,0,1,0,0,0,1,0,0,0
"respect,interactions",6/10/2020 15:48,"During a required annual full day training workshop, the male guest instructor singled me out (a young woman) repeatedly in front of the entire office. He asked me to stand up front for many demonstrations that often involved him touching my shoulders, having me touch his hand, etc. Eventually, I refused to go up front after this went on for several hours. Four colleagues, including my manager, joked about it afterwards and  said things like ""he really liked you,"" and ""he was hitting on you hard."" I was extremely embarrassed. I was also upset that no one in a position of power spoke to him on the side during a break. I was afraid of appearing too confrontational if I had been more stern.",493,67,"leadership,peers",,7,,0,0,0,1,0,0,0,1,0,0,0,1,0,1,0,0
"respect,interactions",6/10/2020 15:54,"During my second week at *company* I was onsite with colleagues for an exam. As the new person everyone was asking getting to know you questions. When it came out that I was a single mom, a gentleman stated under his breath (although loud enough for the entire team to hear) ""great just we need a single mom"". I had to excuse myself from the room to collect myself. I have never felt so excluded from a place of work - that was my second week and the situation has not improved.",494,122,peers,,7,,0,0,0,1,0,0,0,1,0,0,0,0,0,1,0,0
"recognition,respect,interactions",6/10/2020 15:57,"My supervisor speaks to me often in demeaning ways as if I do not know what I am doing in my job. And, instead of adding to my write-ups/memos/STAR comments, he just regurgitates what I already wrote/said.",495,145,manager,,7,,0,0,0,1,0,0,1,1,0,0,0,0,1,0,0,0
"skills,career",6/10/2020 16:00,"My team was allocated a solo examination at a firm in South America. Our team had two female employees who were highly qualified to lead the examination-- myself, who has prior work experience doing audits internationally, including in South America, and another female colleague who is a native Spanish speaker. However, the examination was given to a male examiner who was close with our male manager but did not have the international experience, language skills, or other expertise/tenure that would make him the best fit for the highly-coveted examination.",496,67,manager,,7,,0,1,0,0,0,0,0,0,1,0,0,0,1,0,0,0
"respect,other",6/10/2020 16:04,"At an office Holiday party, a manager started imitating the accent of a Vietnamese-American colleague (and one of his direct reports). Thankfully, she was not there to witness the disrespect.",497,67,manager,,7,,0,0,0,0,0,0,0,1,0,0,0,0,1,0,0,0
"learning,career,respect",6/10/2020 16:05,The supporting staff do not have much room for growth.  The company does not invest in the supporting staff by making room for mobility and creating positions to move up tiers. There are no mentors and shadowing with other departments so that the supporting staff can learn and grow within the company.,498,160,"manager,leadership",,7,,0,1,0,0,1,0,0,1,0,0,0,1,1,0,0,0
interactions,6/10/2020 16:11,"As an employee of a location with less than five female employees (not counting admin and Sr. management), there is active exclusion of female colleagues. Male co-workers do lunch together a few times a week and typically around 11 AM someone walks around asking the other male colleagues if they want to go to lunch  with the guys, deliberately walking past the desks of any female, only to resume the invitation to lunch at the desk of the  next male they reached.",499,122,peers,,7,,0,0,0,1,0,0,0,0,0,0,0,0,0,1,0,0
"skills,learning,career",6/10/2020 16:11,"To quote Mika and Ginny Brzezinski in their recent book ""Comeback Careers,"" ""There's a whole midlife career crisis going on for scores of women in their forties and fifties. In our conversations with these women we heard the word 'invisible' a few too many times."" I had this same conversation multiple times with a woman VP who took the VRP earlier this year. We both felt that our skills and knowledge were ignored. Neither of us were considered for new projects or opportunities for growth. Communication from the top down to us was non-existent. She was discouraged and left the organization.",500,75,"manager,leadership",,7,,0,1,0,0,1,0,0,0,1,0,0,1,1,0,0,0
"life,recognition,respect",6/10/2020 16:13,The supporting staff do not get the same work life balance as everyone in the company.  They get less work from home days.  On *company* volunteer events the supporting staff needs to use their personal days or make up the time if the event is less then 8 hours.  Everyone else gets to go home and does not need to make up the time.  This discourages the supporting staff to volunteer.,501,160,"manager,leadership,policy,hr",,7,,0,0,0,0,0,1,1,1,0,0,1,1,1,0,1,0
"career,recognition,respect",6/10/2020 16:19,"Many of us have heard from HR/People Solutions not to let the door hit us from behind if we leave. There is a wide-spread feeling that HR/PS and senior management does not value us as individual contributors, our experience and institutional knowledge. We have seen vacant positions demoted in level and younger lesser, experienced people brought in to fill them. This limits promotion opportunities and contributes to the demoralizing atmosphere.",502,75,"leadership,hr",,7,,0,1,0,0,0,0,1,1,0,0,1,1,0,0,0,0
"learning,career",6/10/2020 16:21,"I have reported to three different managers in my time at *company*. My immediate manager and next level managers have all been white men (the six people directly responsible for my career and progression), and have promoted mostly other men into management roles. Although senior management at *company* is fairly diverse, first and second level managers are overwhelmingly male, which puts female staff members at a disadvantage. It is well-proven by research that men with male managers move up the fastest. Women need female mentors because often times, male managers are not as comfortable mentoring their female subordinates, having casual conversation, socializing, etc. I sought out a female mentor on my own, and she has helped me significantly, but this is not an issue men in the company have to deal with.",503,67,leadership,,7,,0,1,0,0,1,0,0,0,0,0,0,1,0,0,0,0
"respect,interactions",6/10/2020 16:21,"As former manager of a small group under a larger umbrella within the scope of a single executive, it was not uncommon for me to be excluded from emails and other communications shared with other supervisors.",504,75,"manager,peers",,7,,0,0,0,1,0,0,0,1,0,0,0,0,1,1,0,0
"recognition,respect",6/10/2020 16:27,"A few years ago, I was involved in a project working closely with an outside consultant. The consultants sang my praises to senior management about my work and relationship with them. I felt like it fell on deaf ears.",505,75,"manager,leadership,peers",,7,,0,0,0,0,0,0,1,1,0,0,0,1,1,1,0,0
"career,recognition,respect",6/10/2020 16:36,"My supervisor makes me feel that I can hardly get anything right or just the way he would ""word"" it. It's so hard to please management no matter how many hoops I have to jump through.",506,145,"manager,leadership",,7,,0,1,0,0,0,0,1,1,0,0,0,1,1,0,0,0
"access,career",6/10/2020 16:37,"A female intern approached me because she was nervous about working with my male manager on an assignment. She came to me because I was a female direct report of his. She thought he would not take her ideas seriously because he seemed like the ""good ole' boys club"" type. I told her that he does listen and respect what I have to say, regardless of how he comes off. This example shows the importance of perception. Although the manager was respectful towards his female colleagues, he would take the male teammates to lunch and never invited the women. He also speaks to men and women in drastically different tones. An intern immediately picked up on the difference and was worried she would be excluded for being a young woman.",507,67,manager,,7,,1,1,0,0,0,0,0,0,0,0,0,0,1,0,0,0
"recognition,respect,interactions",6/10/2020 16:40,I have been gas-lighted by management on many occasions.,508,145,"manager,leadership",,7,,0,0,0,1,0,0,1,1,0,0,0,1,1,0,0,0
"recognition,respect,interactions",6/10/2020 16:41,I have been gas-lighted by management on many occasions.,509,145,"manager,leadership",,7,,0,0,0,1,0,0,1,1,0,0,0,1,1,0,0,0
"career,respect",6/10/2020 15:04,bringing up inappropriate use of language regarding a particular race to leadership in a 1:1 and having to defend my stance and provide an alternative way that the language could have been used,407,110,leadership,,7,,0,1,0,0,0,0,0,1,0,0,0,1,0,0,0,0
skills,6/10/2020 16:42,I am consistently passed over for special projects that produce a higher IC or lead to a higher position.,511,145,"manager,leadership",,7,,0,0,0,0,0,0,0,0,1,0,0,1,1,0,0,0
life,6/10/2020 15:04,I am the primary caregiver for an elderly parent.  Consistently being asked to work after-hours puts strain on that caregiving.,408,86,"manager,leadership,peers",,7,,0,0,0,0,0,1,0,0,0,0,0,1,1,1,0,0
interactions,6/10/2020 16:51,"I had one white male colleague who was very unhappy in his job. He was dissatisfied with his responsibilities and had no problem showing it. He had such a poor attitude and would sometimes outright refuse to work on a project.
In the end, he was reassigned to a much better position with much more high visibility projects. It was almost like he was rewarded for his bad behavior. 

However, another black woman in my department had a pretty high visibility role. She worked hard and performed well under the prior leadership. Under the new leadership, they took away her job responsibilities with no explanation and 
gave them to a young white woman in the department. She ended up doing grunt assignments and tasks that no one else wanted to really do. To this day, she still doesn't know what she did wrong or why.She eventually left. 

In my department, it seems like there is such disparate treatment.",513,189,"manager,leadership",,7,,0,0,0,1,0,0,0,0,0,0,0,1,1,0,0,0
compensation,6/10/2020 17:09,No one can adequately explain to me the pay gap between myself and new hires coming at the same level at a significantly hire salary.,514,154,hr,,7,,0,0,1,0,0,0,0,0,0,0,1,0,0,0,0,0
