Categories,Created,Description,Experience ID,Participant ID,Sources,Tag,Workshop,0,Categories-Access,Categories-Career,Categories-Compensation,Categories-Interactions,Categories-Learning,Categories-Life,Categories-Recognition,Categories-Respect,Categories-Skills,Sources-Customers,Sources-HR,Sources-Leadership,Sources-Manager,Sources-Peers,Sources-Policy,Sources-Reports
access,6/11/2020 15:09,Management has favorites within our department. I feel more opportunities are provided to these employees.,850,226,leadership,,7,,1,0,0,0,0,0,0,0,0,0,0,1,0,0,0,0
"access,interactions",6/11/2020 15:09,Networking and getting other points of view is very important. My manager says not to speaker to anyone but her. She specifically said not to talk to HR. I told her manager and he had no issue with it.,851,235,manager,,7,,1,0,0,1,0,0,0,0,0,0,0,0,1,0,0,0
recognition,6/11/2020 14:53,"Coming from a situation where my characteristics are primarily historically privileged, I have honestly never felt excluded because of personal characteristics. I have felt overlooked and not recognized/respected, but never because of my personal characteristics.",705,253,"leadership,manager,peers",,7,,0,0,0,0,0,0,1,0,0,0,0,1,1,1,0,0
"access,skills,recognition,respect",6/11/2020 15:09,"A manager once asked on the floor for assistance in which I raised my hand and volunteer to help, he then said ""No, I will ask the expert"" referring to my co-worker who sat next to me. This made me feel not only excluded but not valued as part of his team.",853,217,manager,,7,,1,0,0,0,0,0,1,1,1,0,0,0,1,0,0,0
"respect,interactions",6/11/2020 15:09,A former *company* employee and securities industry member that I have met often continuously pronounces my name incorrectly,854,327,customers,,7,,0,0,0,1,0,0,0,1,0,1,0,0,0,0,0,0
career,6/11/2020 15:09,"I was told once during a mentoring session that people with beards do not get hired.
I do not know what validity there was to that but it always felt odd.",855,222,manager,,7,,0,1,0,0,0,0,0,0,0,0,0,0,1,0,0,0
recognition,6/11/2020 15:09,"because of having an outgoing personality - ability to socialize and connect people- those traits are not seen as professional or worthy of recognition - sometimes overlooked because ""i'll understand"" and get my recognition one day",856,362,"leadership,manager,peers",,7,,0,0,0,0,0,0,1,0,0,0,0,1,1,1,0,0
career,6/11/2020 15:09,People that look like me were either demoted or non-existent in direct management and I was excluded from that opportunity and no explanation was given as to why I was not considered.,857,320,leadership,,7,,0,1,0,0,0,0,0,0,0,0,0,1,0,0,0,0
"access,skills,learning,recognition,interactions",6/11/2020 14:53,"I have experienced being left out of meeting,being ""partnered on projects where another person was given most of the visible credit.  Not being able to advance until I proved myself when it appeared others were given a greater benefit of the doubt.  I have not always been given projects that would lead to visibility or that were given consideration by members of upper management.",706,328,"policy,leadership,peers",,7,,1,0,0,1,1,0,1,0,1,0,0,1,0,1,1,0
"career,recognition",6/11/2020 15:09,I was consistently given projects that would not lead to visibility or selected to present in forums where upper management wouldn't be present.,859,328,"leadership,manager",,7,,0,1,0,0,0,0,1,0,0,0,0,1,1,0,0,0
respect,6/11/2020 15:09,"I have a female manager who is combative and argumentative in one to one interactions; manager comes unprepared to meetings, discounts the work that I presented.",860,221,manager,,7,,0,0,0,0,0,0,0,1,0,0,0,0,1,0,0,0
"respect,interactions",6/11/2020 15:09,I have heard colleagues complain about working with single mothers,861,302,peers,,7,,0,0,0,1,0,0,0,1,0,0,0,0,0,1,0,0
"skills,respect",6/11/2020 15:09,"Management does not appear to truly my acknowledge skills. I often have to ""prove"" that I am capable to do the examination assigned.",862,329,"leadership,manager",,7,,0,0,0,0,0,0,0,1,1,0,0,1,1,0,0,0
respect,6/11/2020 15:09,Upper Management doesn't even believe Black Lives Matter,863,292,leadership,,7,,0,0,0,0,0,0,0,1,0,0,0,1,0,0,0,0
compensation,6/11/2020 15:09,Upon being hired finding out less qualified individuals hired at the same time were given higher titles and compensation.,865,363,peers,,7,,0,0,1,0,0,0,0,0,0,0,0,0,0,1,0,0
career,6/11/2020 15:09,Heard a Senior Director make a joke on how individuals of a certain ethnicity can't present well.,866,230,manager,,7,,0,1,0,0,0,0,0,0,0,0,0,0,1,0,0,0
access,6/11/2020 15:09,Not included in meetings or conversation on things which I should be involved. The incorrect information is provided and I usually have to correct it.,867,345,manager,,7,,1,0,0,0,0,0,0,0,0,0,0,0,1,0,0,0
"access,learning,compensation,recognition,respect,interactions",6/11/2020 15:09,"No idea what my manager does on a day to day basis, while I can't carve out time to focus on development because I'm carrying a lot of the team. She doesn't feel the need to be transparent about the work distribution, as often, many supervisors feel.",868,286,"leadership,manager,peers",,7,,1,0,1,1,1,0,1,1,0,0,0,1,1,1,0,0
"life,interactions",6/11/2020 15:09,"As a female, feel pressure to suppress my emotions and to always have a smile regardless of what is going on around me",869,309,leadership,,7,,0,0,0,1,0,1,0,0,0,0,0,1,0,0,0,0
"compensation,life",6/11/2020 15:09,"Departments within *company* have different policies. For example, the remote work benefit was adopted by one department a few years before it was allowed in my department. And when it finally was implemented in my department,it was frowned upon by some of our senior managers.",870,249,"leadership,manager,peers",,7,,0,0,1,0,0,1,0,0,0,0,0,1,1,1,0,0
interactions,6/11/2020 15:10,"In a male dominated profession and group, I find it offensive that its assumed I would take care of the social events (i.e.,ordering lunch, etc.)",871,324,"leadership,peers",,7,,0,0,0,1,0,0,0,0,0,0,0,1,0,1,0,0
"access,skills,learning,career,recognition,respect,interactions",6/11/2020 15:10,"During an OTR testimony, which I was supposed to lead, my manager kept jumping in and taking over large portions of the questioning. I was doing a good job and had created the question list. I have experience doing depositions and interviews.",872,238,manager,,7,,1,1,0,1,1,0,1,1,1,0,0,0,1,0,0,0
"access,skills,learning,compensation,career,life,recognition,respect,interactions",6/11/2020 15:10,"I believe because I have a great set of senior leaders and peers in my group, I have not experienced any feelings of exclusion in any of the categories presented here during my time at *company*.",873,245,"policy,leadership,hr,manager,peers,reports",,7,,1,1,1,1,1,1,1,1,1,0,1,1,1,1,1,1
"learning,respect,interactions",6/11/2020 15:10,"I had a peer mentor who made it clear he did not want to mentor me, and undermined me publicly",882,328,peers,,7,,0,0,0,1,1,0,0,1,0,0,0,0,0,1,0,0
"respect,interactions",6/11/2020 15:10,"I work in an environment with many ""alpha male"" types.  If I try to get a word in or continuing talking to finish a point, I'm told to be stop.  However, interruptions, sarcasm, and ""loud"" talking are allowable for men in the room.",875,259,"leadership,manager,peers",,7,,0,0,0,1,0,0,0,1,0,0,0,1,1,1,0,0
"respect,interactions",6/11/2020 15:10,"Being called 'young lady' by an older, male VP in front of a room of people as a response to something I said.",876,274,leadership,,7,,0,0,0,1,0,0,0,1,0,0,0,1,0,0,0,0
"access,career",6/11/2020 15:10,Often the only female and Black person in a management position at meetings,878,327,"hr,customers",,7,,1,1,0,0,0,0,0,0,0,1,1,0,0,0,0,0
"access,respect,interactions",6/11/2020 15:10,Two of my peers are best friends. In meetings they tend to dismiss what I say and just agree with each other. My manager doesn't say anything.,879,235,"manager,peers",,7,,1,0,0,1,0,0,0,1,0,0,0,0,1,1,0,0
"skills,career,recognition",6/11/2020 15:10,There were times in the past where I felt excluded by my team because my suggestions were often not supported.  That has not happened in my current role.,880,349,manager,,7,,0,1,0,0,0,0,1,0,1,0,0,0,1,0,0,0
"respect,interactions",6/11/2020 15:10,"A senior department leader often makes religious references that make me feel uncomfortable, as I observe a different religion.",881,262,leadership,,7,,0,0,0,1,0,0,0,1,0,0,0,1,0,0,0,0
access,6/11/2020 15:10,Managers seem to have favorites who are given access.,884,231,manager,,7,,1,0,0,0,0,0,0,0,0,0,0,0,1,0,0,0
interactions,6/11/2020 15:11,I feel excluded in workplace interactions.,885,360,"leadership,peers",,7,,0,0,0,1,0,0,0,0,0,0,0,1,0,1,0,0
life,6/11/2020 15:11,Extreme pressure to work ADDITIONAL hours prior to maternity leave so that my case numbers are still high for end of year evaluations.,886,218,"leadership,peers",,7,,0,0,0,0,0,1,0,0,0,0,0,1,0,1,0,0
"respect,interactions",6/11/2020 15:11,"I tried to raise a concern to male HR members about how *company* was lacking in policies for when members of the public, like brokers or customers, call us and tell us they are suicidal. At first, I was brushed off and told something like it was not *company*'s duty to take care of these people. When a suicidal broker called me a second time, I raised the concerns again and was finally understood but told to talk to my manager. I already talked to my manager, which is why I was reaching out to HR. While this situation could have been a simple misunderstanding, I felt like these men were discounting me as just an ""emotional,"" ""sympathetic"" woman.",887,244,"policy,hr",,7,,0,0,0,1,0,0,0,1,0,0,1,0,0,0,1,0
"skills,recognition,respect,interactions",6/11/2020 15:11,Found issues with a process and brought it to management's attention with solutions.  I was included on the first email discussing the issue and I was then excluded from the email chain and was informed later by a peer that a meeting was held with technology to discuss and implement a fix.,888,351,"leadership,peers",,7,,0,0,0,1,0,0,1,1,1,0,0,1,0,1,0,0
"access,skills",6/11/2020 15:11,"The other person ask me the question for they do not know and they do not let the other know, where they found the answer.",889,345,manager,,7,,1,0,0,0,0,0,0,0,1,0,0,0,1,0,0,0
access,6/11/2020 15:12,There seems to be a bias towards younger employees.,890,252,manager,,7,,1,0,0,0,0,0,0,0,0,0,0,0,1,0,0,0
access,6/11/2020 15:12,"Men will talk over me in meetings occasionally, but it was much worse when I was younger. I think that it's better now in part because I'm older, but also because I've become more skilled in controlling the conversations.",891,266,"leadership,peers",,7,,1,0,0,0,0,0,0,0,0,0,0,1,0,1,0,0
compensation,6/11/2020 15:12,"I do not feel that I am compensated fairly in salary and rank for my skills, work experience, and years of service at *company*.",892,223,"leadership,hr,manager",,7,,0,0,1,0,0,0,0,0,0,0,1,1,1,0,0,0
"learning,respect",6/11/2020 15:14,"During a meeting, a colleague used the the full name of the cop but only the last name for George Floyd. I think that it was a hard learning moment to see how different people may not realize the systematic racism that we are allowing to happen.",893,206,peers,,7,,0,0,0,0,1,0,0,1,0,0,0,0,0,1,0,0
respect,6/11/2020 15:15,"The use of ""you guys"", ""young lady"", and other terms have been used and are subtly not inclusive.",894,206,"leadership,hr,manager,peers,customers",,7,,0,0,0,0,0,0,0,1,0,1,1,1,1,1,0,0
"respect,interactions",6/11/2020 15:16,"A white, male peer walked out of a room when me, a mixed Asian and white woman, and my other peer, a Latina woman, were trying to explain certain nuances of racism to him.",895,244,peers,,7,,0,0,0,1,0,0,0,1,0,0,0,0,0,1,0,0
respect,6/11/2020 15:10,"Only my work was reviewed and my mistakes were made public to the team.  When I asked why the other team wasn't being reviewed, I was told they would be reviewed next year. Next year never came.",883,318,leadership,,7,,0,0,0,0,0,0,0,1,0,0,0,1,0,0,0,0
"skills,career",6/11/2020 15:18,I feel siloed into my current practice/function though I would like to eventually move to another practice that better suits my skillset.,897,336,"leadership,manager",,7,,0,1,0,0,0,0,0,0,1,0,0,1,1,0,0,0
"career,recognition,respect",6/11/2020 15:18,"Management does not seem to notice my contributions.  For example, I had a responsibility for several years and it was only last year that management seems to have noticed my effort to achieve this task.",898,351,leadership,,7,,0,1,0,0,0,0,1,1,0,0,0,1,0,0,0,0
respect,6/11/2020 15:20,"If I disagreed with my Senior Leader and spoke up, I was classified as too dominant.  He wanted me to act like his other women managers, who just agreed with him or kept their mouth shut. I've had my Incentive Compensation cut because I didn't agree my VP.",899,312,leadership,,7,,0,0,0,0,0,0,0,1,0,0,0,1,0,0,0,0
"learning,respect,interactions",6/11/2020 15:20,"A male colleague, who is in the same position as me, but does have 20 years more experience, works very closely with me. Sometimes brushes off ideas that I have, or comes up with a reason why it wouldnt work (and wont continue the conversation), and does not respect that I bring a lot to the table. My direct manager is much more open, but it is difficult to interact and feel good when interacting with this colleague, even in team meetings.",900,206,peers,,7,,0,0,0,1,1,0,0,1,0,0,0,0,0,1,0,0
"access,learning,career",6/11/2020 15:21,The selection of employees for projects are based on relationship with management.,901,351,"policy,leadership",,7,,1,1,0,0,1,0,0,0,0,0,0,1,0,0,1,0
"access,career",6/11/2020 15:21,"Slots for special projects were often reserved for specific employees, and not made available/known to anyone else. Consequently, I often didn't even have a chance to express interest.",902,302,manager,,7,,1,1,0,0,0,0,0,0,0,0,0,0,1,0,0,0
"skills,recognition,respect",6/11/2020 15:22,"My role is much more limited than those with my title in other offices because my manager is concerned about the feelings of my white peers, although I outrank them. I feel like a figurehead. I have to stay in a very narrow lane. But, on the other hand, my peers ask me to do things that they don't want to do and the reason given is that I outrank them.",903,235,"manager,peers",,7,,0,0,0,0,0,0,1,1,1,0,0,0,1,1,0,0
"access,skills,learning,career,recognition,respect,interactions",6/11/2020 15:22,"Our director does not get involved much with case matters that we work on with our managers. When we do meet with the director to discuss next-steps on serious matters, the director usually dialogues with the manager and not staff during the meeting, although the staff member did the work and knows more about the matter than the manager. As a result, as a staff member, I feel disrespected, excluded and that my contribution to my work doesn't matter.",904,238,"leadership,manager",,7,,1,1,0,1,1,0,1,1,1,0,0,1,1,0,0,0
"respect,interactions",6/11/2020 15:23,"Sometimes my direct superior makes it difficult to bring ""bad news"" to her.",905,359,"leadership,manager",,7,,0,0,0,1,0,0,0,1,0,0,0,1,1,0,0,0
career,6/11/2020 15:26,New management roles are open for young employees.,906,359,"leadership,peers",,7,,0,1,0,0,0,0,0,0,0,0,0,1,0,1,0,0
respect,6/11/2020 15:26,"In a meeting, 2 male colleagues decided we were ""done"" and started talking to each other about another topic, basically dismissing me.",907,322,peers,,7,,0,0,0,0,0,0,0,1,0,0,0,0,0,1,0,0
"respect,interactions",6/11/2020 15:27,Male co-workers have frequently commented on my dietary choices when they perceive them to be unhealthy.,908,317,peers,,7,,0,0,0,1,0,0,0,1,0,0,0,0,0,1,0,0
"respect,interactions",6/11/2020 15:28,"A male co-worker told me that I ""must have maternal instincts"".",909,317,peers,,7,,0,0,0,1,0,0,0,1,0,0,0,0,0,1,0,0
"respect,interactions",6/11/2020 15:28,"A male co-worker told me that I needed to keep my ""biological clock"" in mind.",910,317,peers,,7,,0,0,0,1,0,0,0,1,0,0,0,0,0,1,0,0
"access,skills,recognition",6/11/2020 15:30,My management told me that I might not be allowed to attend a meeting with senior level staff to present my work so that I could take a training course instead.,911,317,"leadership,manager",,7,,1,0,0,0,0,0,1,0,1,0,0,1,1,0,0,0
respect,6/11/2020 15:31,I overheard a co-worker saying he was happy he was having a son because he likes sports and couldn't have shared that with a daughter.,912,317,peers,,7,,0,0,0,0,0,0,0,1,0,0,0,0,0,1,0,0
interactions,6/11/2020 15:31,"An email was sent to a group, addressed to ""ladies and [two individual male names]"" rather than addressing everyone equally.",913,317,peers,,7,,0,0,0,1,0,0,0,0,0,0,0,0,0,1,0,0
"learning,career",6/11/2020 15:32,"When asking my previous manager for the opportunity to take on more challenging assignments, I often encountered resistance or flat out rejection without a valid explanation (""let's just wait""). On the other hand, male coworkers with less experience were encouraged to take on those assignments.",914,302,manager,,7,,0,1,0,0,1,0,0,0,0,0,0,0,1,0,0,0
"learning,compensation,life,recognition,respect",6/11/2020 15:33,"While discussing my long due promotion, I was told by my direct manager that when the direct manager tried to have the conversation with next level management, the direct manager was reminded of a situation when I have to leave office one day in the middle of the day to take my sick child to the doctor while there were questions about a matter that I was working on. I felt that my new situation of having a family and becoming a mother and not being available 100% for the job was used against me in the decision to be promoted.",915,351,"policy,leadership",,7,,0,0,1,0,1,1,1,1,0,0,0,1,0,0,1,0
"access,interactions",6/11/2020 15:34,"During a meeting, a customer directed information specifically to my manager rather than to myself or to us as a team, even though I had arranged and was running the meeting.",916,317,customers,,7,,1,0,0,1,0,0,0,0,0,1,0,0,0,0,0,0
"access,learning,career,respect",6/11/2020 15:35,"My co-worker told me that he and my manager attended a recruiting event and were discussing the attractiveness of the women coming to talk to them and likelihood of ""scoring"" with them.",917,317,"manager,peers",,7,,1,1,0,0,1,0,0,1,0,0,0,0,1,1,0,0
"compensation,career,recognition",6/11/2020 15:37,"When I told my manager I thought I deserved a larger raise and enumerated why, he only said that ""you can't get big raises forever"", even though I am at the lower end of the salary range for my grade level.",918,317,manager,,7,,0,1,1,0,0,0,1,0,0,0,0,0,1,0,0,0
"access,respect,interactions",6/11/2020 15:55,"Told to 'be nicer', I wasn't being mean, I was holding a standard. I've never once heard a male colleague told to be nicer.",920,299,"leadership,manager",,7,,1,0,0,1,0,0,0,1,0,0,0,1,1,0,0,0
"compensation,career,recognition,respect",6/11/2020 15:56,Male peers or directs earning a higher base salary than female peer or manager.,921,299,"leadership,hr,manager",,7,,0,1,1,0,0,0,1,1,0,0,1,1,1,0,0,0
interactions,6/11/2020 16:14,"When I see others being excluded, it affects me. We've had meetings where my peers and manager talk about staff in a way that I find exclusionary. I've struggled with how I can influence them to be more inclusive and stop being distracted by personal things about people and their own personal feelings. I think I've made progress. At least in front of me, that happens much less frequently. But, it still does happen and I see it most in how they evaluate people without giving priority to people's performance. It's uncomfortable and decreases my trust in them. When your manager is involved, there's no one to talk to so it makes me feel isolated too.",922,235,"manager,peers",,7,,0,0,0,1,0,0,0,0,0,0,0,0,1,1,0,0
"learning,respect",6/11/2020 20:19,"*company* has the chronic problem of staffing its senior positions using nepotism and connections. This has transported into the new transformed *company* as well. In many cases, the leaders do not know even know what the direct reports produce. This converts their attention to other issues, such as communication, blame games, and equivocations. I have often seen that an opinions is weighted by stereotypical impressions. Being a person of color, this weighs very heavily, but we do grin and bear it.",923,369,leadership,,7,,0,0,0,0,1,0,0,1,0,0,0,1,0,0,0,0
"skills,interactions",6/11/2020 20:28,"*company* leadership does not value external experience, and expertise. It seems that the lower your qualifications, the higher you go, provided you know the right people. I have myself seen myself pushed out of leadership role, over time, and now take orders from someone who does not even have a understanding of what I do. I suppose this is a form of anti-intellectual bias combined with some of the other biases, that lead to non-inclusion. The people of color are often suppressed from showing their skills to the senior management here, and I have been personally affected by this.",924,369,"leadership,manager",,7,,0,0,0,1,0,0,0,0,1,0,0,1,1,0,0,0
"compensation,career",6/11/2020 20:41,"Over the past 5 years, my reputation with the firms has grown. I have even been invited to conferences in my area of expertise. But, within *company*, sadly, I have faced lower compensation (IC has been continuously incrementally decreased over the past 4 years), have been demoted by one grade, and my net level in post-transformation is one level lower. One way this was achieved was by, for example, by citing me in my annual evaluation (2018) for asking a question in the Town Hall meeting held by the newly appointed head of the group. It was argued that I was ""disrespectful"". And that the senior leaders of the division were uncomfortable! Just because I asked where we would be placed, and asked a followup. I wrote a rebuttal in my evaluation, but got no response either from the leadership of the division or HR. All that evaporated were parts of my IC and prospects upwards. Additionally, I have never been given the option of a ""skip level"" meeting, as I understand is common, and have never attended any calibration meetings, even though I was at that level. I am quite sure that if I was not of the ethnicity that I am, this would not have happened, but I cannot prove it. One can measure this easily, by observing that as one ascends the hierarchy in *company*, the experience does not play a role.",925,369,"leadership,hr,manager",,7,,0,1,1,0,0,0,0,0,0,0,1,1,1,0,0,0
respect,6/23/2020 12:02,My customers disrespect me all the time.,927,377,customers,,3,,0,0,0,0,0,0,0,1,0,1,0,0,0,0,0,0
"respect,interactions",6/23/2020 12:02,Terrible experience with my peers. The make fun of my accent.,928,377,peers,,3,,0,0,0,1,0,0,0,1,0,0,0,0,0,1,0,0
"respect,interactions",6/25/2020 19:43,"My manager calls me ""baby"" and I hate it",940,385,manager,,3,,0,0,0,1,0,0,0,1,0,0,0,0,1,0,0,0
access,7/14/2020 15:16,I was not invited to the womens leadership development programme back when I was a more junior colleague,1035,444,leadership,,3,,1,0,0,0,0,0,0,0,0,0,0,1,0,0,0,0
"respect,interactions",7/24/2020 15:31,My boss always criticizes my taste in clothing.,1037,448,manager,,3,,0,0,0,1,0,0,0,1,0,0,0,0,1,0,0,0
"compensation,recognition",7/27/2020 13:46,I'm not paid as much as my younger male peer,1038,449,"hr,manager",,3,,0,0,1,0,0,0,1,0,0,0,1,0,1,0,0,0
"access,respect",7/30/2020 22:40,I'm often interrupted or talked over during team meetings.,1039,450,"manager,peers",,3,,1,0,0,0,0,0,0,1,0,0,0,0,1,1,0,0
"respect,interactions",6/23/2020 20:23,"I was recently in a meeting and tried to share some ideas I had, but kept being interrupted by my peers",929,379,"manager,peers",,1,,0,0,0,1,0,0,0,1,0,0,0,0,1,1,0,0
respect,6/24/2020 14:51,Not being U.S.-born made me feel like a second-class citizen.,930,382,leadership,,1,,0,0,0,0,0,0,0,1,0,0,0,1,0,0,0,0
"respect,interactions",6/24/2020 14:51,"The head of our organization stopped and stared at me for an extended period of time while I was working. When I asked him what he was up to, he said ""just watching you work.""",931,381,leadership,,1,,0,0,0,1,0,0,0,1,0,0,0,1,0,0,0,0
interactions,6/24/2020 14:52,I am in an interracial relationship and the head of our organization told me in a performance review that my partner and I should explore why we married one another.,932,381,leadership,,1,,0,0,0,1,0,0,0,0,0,0,0,1,0,0,0,0
"respect,interactions",6/24/2020 14:53,"I am fairly short, my manager is very tall. He often stands right in front of me in a way that is very intimidating.",933,382,manager,,1,,0,0,0,1,0,0,0,1,0,0,0,0,1,0,0,0
career,6/24/2020 14:53,"I used to work for in hospitality, the company I worked for I requested to be made a manager of the spa at this particular inn. I said I don't need any additional pay and would take on all managerial responsibilities, just for the resume experience, but was repeatedly denied despite having all the necessary skills.",934,383,"leadership,manager,peers",,1,,0,1,0,0,0,0,0,0,0,0,0,1,1,1,0,0
"recognition,respect",6/24/2020 14:53,I shared an idea in a meeting and just a few minutes later another (male) colleague shared the same and they were given the credit for the idea.,935,381,peers,,1,,0,0,0,0,0,0,1,1,0,0,0,0,0,1,0,0
"respect,interactions",6/24/2020 14:53,People talk about sports during meetings but I don't follow sports and feel left out.,936,382,"manager,peers",,1,,0,0,0,1,0,0,0,1,0,0,0,0,1,1,0,0
life,6/24/2020 14:54,"My partner was having surgery and when I asked the team if we could reschedule a meeting so I would join him in the hospital, they said ""no.""",937,381,peers,,1,,0,0,0,0,0,1,0,0,0,0,0,0,0,1,0,0
